"Story","Title","Result","Date","Stability","Duration (s)"
"C07 f04 s001 catalog admin operations","C07-F04-S001-01 Catalog Admin Operations","SUCCESS","2017-10-30T16:13:10.254Z","0.0","0.77"
"C07 f04 s002 category admin operations","C07-F04-S002-01 Category Admin Operations","SUCCESS","2017-10-30T16:13:11.027Z","0.0","1.36"
"C07 f04 s003 policy admin operations","C07-F04-S003-01 Add Policy and update catalog item","SUCCESS","2017-10-30T16:13:12.389Z","0.0","1.86"
"C07 f04 s003 policy admin operations","C07-F04-S003-02 Order catalog item which has policy approval and approve it","SUCCESS","2017-10-30T16:13:14.253Z","0.0","17.93"
"C07 f04 s003 policy admin operations","C07-F04-S003-03 Delete Policy","SUCCESS","2017-10-30T16:13:32.184Z","0.0","0.53"
"C07 f04 s004 content admin operations","C07-F04-S004-01 Content Management Admin Operations","SUCCESS","2017-10-30T16:13:32.718Z","0.0","0.57"
"C07 f04 s005 supplier synchronize requests","C07-F04-S005-01 Supplier Synchronize Service Requests","SUCCESS","2017-10-30T16:13:33.295Z","0.0","15.23"
"C07 f04 s005 supplier synchronize requests","C07-F04-S005-02 Supplier Synchronize Support Requests","SUCCESS","2017-10-30T16:13:48.521Z","0.0","20.08"
