"Story","Title","Result","Date","Stability","Duration (s)"
"C08 f04 s001 auto suggested search","C08-F04-S001-01 Test auto suggested search only article and news","SUCCESS","2017-10-30T03:10:44.166Z","0.0","3.16"
"C08 f04 s001 auto suggested search","C08-F04-S001-02 Test auto suggested search only service offering","SUCCESS","2017-10-30T03:10:47.327Z","0.0","1.18"
"C08 f04 s001 auto suggested search","C08-F04-S001-03 Test auto suggested search only support offering","SUCCESS","2017-10-30T03:10:48.507Z","0.0","1.69"
"C08 f04 s002 search","C08-F04-S002-01 Test search","SUCCESS","2017-10-30T03:10:50.279Z","0.0","1.62"
"C08 f04 s003 search view article","C08-F04-S003-01 Test view article in search result","SUCCESS","2017-10-30T03:10:51.901Z","0.0","3.95"
